{
  "schema_version": "1.0",
  "story_id": "pigeons-from-hell",
  "scene_id": "old-plantation-house-loomed-darkening-shadow-stretching",
  "index": 0,
  "text": "The old plantation house loomed against the darkening sky, its shadow stretching like a corpse across the overgrown lawn. Twisted oaks dripped with Spanish moss, swaying in the windless dread of a Louisiana night.\n\nBranner: Something evil walks these halls. I can feel it in my bones.\n\nThe silence was absolute, broken only by the distant cry of a night bird deep in the bayou swamp.",
  "visual_description": "The old plantation house loomed against the darkening sky, its shadow stretching like a corpse across the overgrown lawn. Twisted oaks dripped with Spanish moss, swaying in the windless dread of a Louisiana night.",
  "mood": "dread",
  "word_count": 71
}
